{
  "decision": {
    "state": "READY_FOR_NEXT_CYCLE",
    "status_vector": [
      "OK",
      "OK",
      "OK"
    ]
  },
  "objective": "observe_diverge_converge_artifact_validation_surface",
  "phases": [
    {
      "artifact": "artifacts/validation/mfn_surface_state.json",
      "command": [
        "/usr/bin/python3",
        "tools/mfn_surface_check.py"
      ],
      "phase": "observe",
      "returncode": 0,
      "status": "OK",
      "stderr": ""
    },
    {
      "artifact": "artifacts/validation/json_artifact_checks.json",
      "command": [
        "/usr/bin/python3",
        "tools/run_json_artifact_checks.py"
      ],
      "phase": "validate",
      "returncode": 0,
      "status": "OK",
      "stderr": ""
    },
    {
      "artifact": "artifacts/validation/json_contract_receipt.json",
      "command": [
        "/usr/bin/python3",
        "tools/json_contract_receipt.py",
        "--out",
        "artifacts/validation/json_contract_receipt.json"
      ],
      "phase": "receipt",
      "returncode": 0,
      "status": "OK",
      "stderr": ""
    }
  ],
  "schema_version": "autonomy_cycle.v1",
  "trend_update": {
    "returncode": 0,
    "stderr": ""
  }
}
